{
  "$schema": "https://json-schema.org/draft/2020-12/schema",
  "$id": "https://quota-reset-index.invalid/schema/reset-event.schema.json",
  "title": "Quota reset event",
  "description": "One discretionary quota reset by an AI vendor. Append-only: once committed, every non-null field except superseded_by is sealed. Corrections are new records that point back via superseded_by.",
  "type": "object",
  "additionalProperties": false,
  "required": [
    "id",
    "vendor",
    "kind",
    "effective_at",
    "effective_at_precision",
    "observed_at",
    "scope",
    "trigger",
    "confidence",
    "evidence",
    "recorded_by",
    "superseded_by",
    "notes"
  ],
  "properties": {
    "id": {
      "description": "<vendor-prefix>-<YYYY-MM-DD>-<nn>. Prefix cx = codex, cc = claude-code. Date component is the effective_at date in UTC. Must equal the filename stem.",
      "type": "string",
      "pattern": "^(cx|cc)-[0-9]{4}-[0-9]{2}-[0-9]{2}-[0-9]{2}$"
    },
    "vendor": {
      "type": "string",
      "enum": ["codex", "claude-code"]
    },
    "kind": {
      "description": "The PRIMARY effect. Retained because it is sealed on every record written before 2026-07-26. Where a record carries `effects`, this must equal effects[0].",
      "type": "string",
      "enum": [
        "global_reset",
        "banked_reset",
        "limit_increase",
        "limit_removal",
        "scheduled_recycle"
      ]
    },
    "effects": {
      "description": "OPTIONAL, added 2026-07-26 (operator-approved). One vendor announcement routinely carries several distinct quota effects — an immediate reset AND a forward-looking cap removal are different primitives, and `kind` can hold only one. Ordered: effects[0] is the primary effect and must equal `kind`. Non-quota changes shipped in the same announcement (model efficiency gains, redemption-surface changes) are DELIBERATELY not enumerable here — they do not alter allowance — and belong in scope.notes.",
      "type": "array",
      "minItems": 1,
      "uniqueItems": true,
      "items": {
        "type": "string",
        "enum": [
          "global_reset",
          "banked_reset",
          "limit_increase",
          "limit_removal",
          "scheduled_recycle"
        ]
      }
    },
    "effective_at": {
      "description": "When the reset took effect. RFC 3339, UTC, Z-suffixed.",
      "type": "string",
      "format": "date-time",
      "pattern": "Z$"
    },
    "effective_at_precision": {
      "description": "How well effective_at is actually known. Never guess a timestamp to look precise — downgrade this instead.",
      "type": "string",
      "enum": ["exact", "hour", "day"]
    },
    "observed_at": {
      "description": "When we learned of it. Must be >= effective_at.",
      "type": "string",
      "format": "date-time",
      "pattern": "Z$"
    },
    "scope": {
      "type": "object",
      "additionalProperties": false,
      "required": ["windows", "plans", "partial", "notes"],
      "properties": {
        "windows": {
          "description": "Which quota windows were reset, e.g. weekly, 5h, monthly. Empty array means the window was never established — asserting one we cannot source would be inventing scope.",
          "type": "array",
          "items": { "type": "string", "minLength": 1 }
        },
        "plans": {
          "description": "Which subscription plans were affected. Empty array means not established.",
          "type": "array",
          "items": { "type": "string", "minLength": 1 }
        },
        "partial": {
          "description": "PREDICATE, fixed 2026-07-26 so this is not re-litigated per record. TRUE iff an ADMISSIBLE source states that the grant reached only some of the accounts otherwise inside scope.plans/scope.windows — a headcount (\"500k users\"), a percentage, a named cohort, or a staged rollout. FALSE means an admissible source supports universal coverage. NULL means UNESTABLISHED — no source addresses coverage either way. ⚠️ NULL was added 2026-07-26 because a REQUIRED BOOLEAN CANNOT SAY \"WE DO NOT KNOW\", and that is the root cause of the 2026-07-26 audit: 24 of 29 records carried at least one over-claimed field, and 9 of those were this one field asserting coverage no source addressed. A restriction on WHEN a benefit applied (off-peak hours) or on WHICH WINDOW was reset is NOT partial — only account coverage counts. Note also: if the only source for a restriction is inadmissible under §2's mirror rule, this stays FALSE or NULL even where the restriction is probably real. The field tracks what is sourceable; scope.notes carries the rest.",
          "type": ["boolean", "null"]
        },
        "notes": { "type": "string" }
      }
    },
    "trigger": {
      "description": "Why the grant happened. `unknown` means no admissible source states a cause — pair it with field_support.trigger = \"unestablished\". ⚠️ `competitive_response` and `demand_surge` were added 2026-07-26 by migration 02, because two records had an ATTESTED cause the original enum could not express, and recording an attested cause as `unknown` would have made those records less accurate rather than more. If a future audit finds another such case, extend the enum rather than flattening the cause to `unknown`.",
      "type": "string",
      "enum": [
        "incident_compensation",
        "launch",
        "milestone",
        "courtesy",
        "capacity",
        "competitive_response",
        "demand_surge",
        "unknown"
      ]
    },
    "confidence": {
      "description": "confirmed = a vendor post or status page states it. probable = multiple independent sources, consistent timing. reported = single source. ⚠️ AMENDED 2026-07-26: `telemetry` was struck from the confirming set. Telemetry establishes that an account's quota changed, never that the vendor granted anything — no channel distinguishes a vendor-wide grant from a scheduled rollover — so it would confirm a proposition this ledger does not record.",
      "type": "string",
      "enum": ["confirmed", "probable", "reported"]
    },
    "evidence": {
      "description": "At least one item. A record with no evidence does not exist.",
      "type": "array",
      "minItems": 1,
      "items": {
        "type": "object",
        "additionalProperties": false,
        "required": ["type", "url", "author", "captured_at", "archive_url"],
        "properties": {
          "type": {
            "type": "string",
            "enum": ["vendor_post", "status_page", "telemetry", "user_report", "press"]
          },
          "url": {
            "type": "string",
            "format": "uri",
            "pattern": "^https?://"
          },
          "author": {
            "description": "Named author or handle where there is one, otherwise null.",
            "type": ["string", "null"],
            "minLength": 1
          },
          "captured_at": {
            "type": "string",
            "format": "date-time",
            "pattern": "Z$"
          },
          "archive_url": {
            "description": "Wayback or archive.today copy, once one exists.",
            "type": ["string", "null"],
            "format": "uri",
            "pattern": "^https?://"
          }
        }
      }
    },
    "recorded_by": {
      "description": "Who entered this record.",
      "type": "string",
      "minLength": 1
    },
    "superseded_by": {
      "description": "Null, or the id of the record that corrects this one. On a SEALED record this is the only mutable field.",
      "type": ["string", "null"],
      "pattern": "^(cx|cc)-[0-9]{4}-[0-9]{2}-[0-9]{2}-[0-9]{2}$"
    },
    "notes": { "type": "string" },
    "field_support": {
      "description": "OPTIONAL, added 2026-07-26. THE ROOT-CAUSE FIX from the audit of that date. Records the PROVENANCE of each enrichment field, separately from its value, because a populated field is otherwise indistinguishable from an asserted one. `attested` = a source states this OF THIS EVENT. `inferred` = it follows from a class-level statement about how the mechanism generally works, or from a neighbouring event — plausible, but nobody asserted it here. `unestablished` = no source addresses it. Absent means the provenance was never recorded, which is the honest reading of every record written before 2026-07-26. The audit found 41 field values across 24 records that were `inferred` or `unestablished` while reading as assertions; this field is what stops that recurring, because filling it in forces the question to be asked.",
      "type": "object",
      "additionalProperties": false,
      "properties": {
        "trigger": { "type": "string", "enum": ["attested", "inferred", "unestablished"] },
        "scope_windows": { "type": "string", "enum": ["attested", "inferred", "unestablished"] },
        "scope_plans": { "type": "string", "enum": ["attested", "inferred", "unestablished"] },
        "scope_partial": { "type": "string", "enum": ["attested", "inferred", "unestablished"] }
      }
    },
    "status": {
      "description": "OPTIONAL, added 2026-07-26. Absent means \"sealed\" — every record written before this field existed is sealed, and stays sealed. A \"provisional\" record is explicitly unsealed: it may still be edited, because it marks a question rather than asserting an answer. Promotion to sealed is one-way.",
      "type": "string",
      "enum": ["provisional", "sealed"]
    },
    "links": {
      "description": "OPTIONAL, added 2026-07-26. Typed relations to other records. Exists because `superseded_by` was the only inter-record link and it means \"corrected by\", which is the wrong semantics for \"these two records disagree\" or \"these came from one announcement\".",
      "type": "array",
      "items": {
        "type": "object",
        "additionalProperties": false,
        "required": ["relation", "id", "note"],
        "properties": {
          "relation": {
            "description": "conflicts_with = these records may describe the same underlying event, or contradict each other, and a human must rule. same_announcement_as = one vendor announcement produced both records (see the multi-effect schema defect). related_to = weaker association, stated in the note.",
            "type": "string",
            "enum": ["conflicts_with", "same_announcement_as", "related_to"]
          },
          "id": {
            "type": "string",
            "pattern": "^(cx|cc)-[0-9]{4}-[0-9]{2}-[0-9]{2}-[0-9]{2}$"
          },
          "note": { "type": "string" }
        }
      }
    }
  }
}
