{
  "id": "cx-2026-07-11-01",
  "vendor": "codex",
  "kind": "global_reset",
  "effective_at": "2026-07-11T00:00:00Z",
  "effective_at_precision": "day",
  "observed_at": "2026-07-25T18:45:00Z",
  "scope": {
    "windows": [
      "weekly"
    ],
    "plans": [
      "all paid plans"
    ],
    "partial": false,
    "notes": "⚠️ DATE IS TIMEZONE-SENSITIVE. This is the SECOND of the pre-announced pair. It landed 2026-07-11T05:54Z, which is 2026-07-10 22:54 US/Pacific — i.e. it is 'the second one on July 10' only in Pacific time, and falls on July 11 in UTC. This is exactly why some trackers render the launch-week burst as 'Jul 10 ×2, Jul 11 ×1' and others as 'Jul 9, Jul 10, Jul 10 (again)'. Same shape as its twin: non-banked fleet-wide weekly-quota reset across Codex and ChatGPT Work, paid plans."
  },
  "trigger": "launch",
  "confidence": "probable",
  "evidence": [
    {
      "type": "press",
      "url": "https://explainx.ai/blog/fable-5-gpt-5-6-rate-limit-resets-july-2026",
      "author": null,
      "captured_at": "2026-07-25T18:45:00Z",
      "archive_url": null
    },
    {
      "type": "press",
      "url": "https://the-decoder.com/openai-admits-it-didnt-get-everything-quite-right-with-chatgpt-work-launch-and-scrambles-to-fix-ux-and-costs/",
      "author": null,
      "captured_at": "2026-07-25T18:45:00Z",
      "archive_url": null
    },
    {
      "type": "press",
      "url": "https://lapaasvoice.com/openai-reset-chatgpt-work-and-codex-rate-limits-twice-after-gpt-5-6-sol-launch/",
      "author": null,
      "captured_at": "2026-07-25T18:45:00Z",
      "archive_url": null
    },
    {
      "type": "user_report",
      "url": "https://minimaxir.com/2026/07/agent-quota-reset/",
      "author": "Max Woolf (minimaxir)",
      "captured_at": "2026-07-25T18:45:00Z",
      "archive_url": null
    }
  ],
  "recorded_by": "claude-code-agent",
  "superseded_by": null,
  "notes": "Research recovered a finer timestamp (2026-07-11T05:54:25Z) but precision is \"day\", so effective_at is truncated rather than asserting accuracy we do not have. The finer value is generally the ANNOUNCEMENT time, not the moment the reset landed. Confidence downgraded confirmed -> probable by adversarial verification. Operator's original lead was dated codex 2026-07-10 (second of two that day); evidence places it on 2026-07-11. Seeded in Phase 1 by agent research; NOT yet reviewed by the operator. Verifier: EVENT SURVIVES AND IS NOT A DUPLICATE; CONFIDENCE GRADE DOES NOT SURVIVE. I attacked this hardest as a double-count of lead 2 and it held on four independent grounds: explainx's Fable-5 article reproduces the announcement text VERBATIM including 'And another one will come later in the day.' (attributed @thsottiaux, July 10) -- the first reset explicitly promises a second the same day; the-decoder…"
}
