{
  "id": "cc-2026-06-02-01",
  "vendor": "claude-code",
  "kind": "global_reset",
  "effective_at": "2026-06-02T00:00:00Z",
  "effective_at_precision": "day",
  "observed_at": "2026-07-25T18:45:00Z",
  "scope": {
    "windows": [],
    "plans": [
      "Pro",
      "Max"
    ],
    "partial": false,
    "notes": "Reset was scoped to IMPACTED Pro and Max subscribers, not all users. Root cause reported as Claude Code sub-agents multiplying excessively and burning tokens abnormally fast during the June 2 incident ('Elevated errors on Opus 4.6', 06:04-11:49 UTC). Which usage window was refilled is NOT stated by my source. Weakest-sourced Claude lead here: one real trade publication plus content-farm restatements; I could not corroborate from a vendor or status-page source."
  },
  "trigger": "incident_compensation",
  "confidence": "reported",
  "evidence": [
    {
      "type": "press",
      "url": "https://www.storyboard18.com/digital/anthropics-claude-ai-suffers-disruption-what-caused-the-outage-and-why-user-quotas-were-reset-99951.htm",
      "author": "Storyboard18 (published June 2, 2026)",
      "captured_at": "2026-07-25T18:45:00Z",
      "archive_url": null
    }
  ],
  "recorded_by": "claude-code-agent",
  "superseded_by": "cc-2026-06-02-02",
  "notes": "Verifier graded the date \"unknown\". Recorded at the schema's coarsest precision, \"day\"; treat as approximate. Seeded in Phase 1 from the completeness sweep; NOT yet reviewed by the operator. Verifier: SURVIVES, with precision downgraded. Attacked on every axis and the core held. (1) URL live (200) and contains the claimed quote VERBATIM, not paraphrased: \"Anthropic restored usage allowances for affected Pro and Max users after a technical issue triggered unusually high token consumption.\" It also carries a stronger second line: \"The company has also rolled out an emergency quota reset for impacted users, meaning…"
}
